id,status,checkpoint,scope,target_files,acceptance,verification,notes
CM-004.1,pending,Create Asio runtime owner,"Runtime lifecycle boundary","src/DownloadEngine.*; new runtime files; cmake/Sources.cmake","A single Boost.Asio runtime owner exists for timers, posted wakeups, cancellation, and shutdown.","Pending.","Initial integration may bridge to the old command loop while protocol migration proceeds."
CM-004.2,pending,Map timers and wakeups,"Time-based command integration","src/DownloadEngine.*; src/TimeBasedCommand.*; new runtime files","Timer and wakeup behavior can be driven through the runtime boundary without busy loops.","Pending.","Preserve existing graceful and force halt semantics."
CM-004.3,pending,Map signal shutdown,"Process signal handling","src/DownloadEngine.*; src/main.cc; new runtime files","Signal handling enters the same shutdown path as existing DownloadEngine halt behavior.","Pending.","Do not weaken emergency shutdown."
CM-004.4,pending,Plan native event poll removal,"Old event loop ownership","src/EventPoll.*; src/EpollEventPoll.*; src/PollEventPoll.*; src/KqueueEventPoll.*; src/SelectEventPoll.*; src/PortEventPoll.*; src/LibuvEventPoll.*","A deletion plan is recorded for old pollers and libuv after protocol users migrate.","Pending.","Physical removal can happen after no protocol path depends on old pollers."
CM-004.5,pending,Verify runtime boundary,"Focused runtime tests","tests/DownloadEngineTest.cc or new focused tests","Runtime start, wake, timer, and shutdown behavior is covered without broad socket-heavy scaffolding.","Pending.","Use focused tests only."
