id,status,checkpoint,scope,target_files,acceptance,verification,notes
CM-013.1,verified,Centralize OpenSSL ownership,"TLS and crypto backend policy","cmake/modules; src/TLS*; src/MessageDigest*; dependency-ledger.csv","OpenSSL is recorded and implemented as the only supported direct TLS and crypto backend unless a specific exception is verified.","`cmake --preset default`, `cmake --build --preset default`, `build/default/aria2_tests 'All Tests/aria2::MessageDigestTest'`, `build/default/aria2_tests 'All Tests/aria2::FeatureConfigTest'`, and HTTPS smoke passed.","libcurl also uses the selected TLS backend in packaging."
CM-013.2,verified,Remove alternate TLS backends,"GnuTLS WinTLS backend cleanup","src/Libgnutls*; src/WinTLS*; cmake files; packaging files","GnuTLS and WinTLS source, options, docs, and packaging entries are removed.","Deleted GnuTLS and WinTLS source files; public stale scans for GnuTLS and WinTLS passed; release workflow, Dockerfiles, manual, and Windows package note no longer expose those backends.","Windows release closure now uses OpenSSL-only wording."
CM-013.3,verified,Remove alternate crypto backends,"nettle libgcrypt GMP internal fallback cleanup","src/Libnettle*; src/Libgcrypt*; src/Libgmp*; src/InternalMessageDigestImpl.*; cmake files; packaging files","Obsolete crypto fallback backends are removed after supported hash needs map to OpenSSL or narrow native helpers.","Deleted nettle, libgcrypt, GMP, internal ARC4, internal digest, internal DH, and OpenSSL DH residue; stale scans for removed crypto backends passed.","ED2K retains only narrow native MD4."
CM-013.4,verified,Review ED2K hash and obfuscation needs,"ED2K-specific crypto boundary","src/ed2k_hash.*; src/ed2k_aich.*; src/Ed2kCommand.*","ED2K MD4, MD5, AICH, and obfuscation helpers are explicitly mapped to OpenSSL or retained narrow native code.","ED2K focused tests passed for MD4 digest, AICH hash tree, and KAD obfuscated packet roundtrip.","ED2K MD4 remains native; MD5, SHA-1, and RC4 use OpenSSL-backed paths."
CM-013.5,verified,Verify TLS crypto cleanup,"Build tests and stale backend scans","tests; source scans; packaging scans","Crypto/TLS focused tests pass and stale backend scans confirm only intended ownership remains.","Full `ctest --preset default --output-on-failure`, packaging script syntax checks, CSV parser check, `git diff --check`, and stale backend scans passed.","Certificate behavior is verified through the libcurl/OpenSSL HTTPS smoke."
