id,status,checkpoint,scope,target_files,acceptance,verification,notes
CM-008.1,pending,Map cookies to libcurl,"Cookie jar and Set-Cookie behavior","new CurlTransfer files; option handling; tests","Supported cookie load/save behavior is mapped to libcurl cookie APIs.","Pending.","Browser cookie import is not automatically retained."
CM-008.2,pending,Decide browser cookie import,"Firefox Chromium SQLite cookie behavior","src/CookieStorage.*; src/Sqlite3CookieParser*; dependency-ledger.csv","Browser cookie import is either removed or justified by current product value with a narrow owner.","Pending.","Chrome encrypted cookie import is a prune candidate."
CM-008.3,pending,Map netrc and auth,"Netrc and authentication ownership","src/Netrc*; src/AuthConfig*; new CurlTransfer files","netrc and auth behavior is mapped to libcurl where retained, and obsolete native parsers are removed.","Pending.","Keep only public behavior that remains documented."
CM-008.4,pending,Remove native proxy helpers,"Proxy request/tunnel source cleanup","src/AbstractProxy*; src/HttpProxy*; src/FtpTunnel*; tests","Native proxy request and tunnel helpers are removed after libcurl owns proxying.","Pending.","RPC server proxy concepts are out of scope."
CM-008.5,pending,Verify auth proxy cookie cleanup,"Focused tests and stale scans","tests; source inventory","Focused behavior tests pass and stale cookie/netrc/proxy source scans match retained ownership.","Pending.","Delete tests for removed browser import internals."
