id,status,checkpoint,scope,target_files,acceptance,verification,notes
CM-004.1,verified,Create Asio runtime owner,"Runtime lifecycle boundary","src/AsioRuntime.*; src/DownloadEngine.*; cmake/Sources.cmake","A single Boost.Asio runtime owner exists for timers, posted wakeups, cancellation, and shutdown.","`cmake --build --preset default` linked aria2-next and aria2_tests with AsioRuntime in cmake/Sources.cmake; `build/default/aria2_tests 'All Tests/aria2::DownloadEngineTest'` passed.","Initial integration bridges to the old command loop while protocol migration proceeds."
CM-004.2,verified,Map timers and wakeups,"Time-based command integration","src/AsioRuntime.*; src/DownloadEngine.*","Timer and wakeup behavior can be driven through the runtime boundary without busy loops.","Focused tests cover posted task wake, timer wake, and wake consumption. `git diff --check` passed.","TimeBasedCommand still exists until protocol users migrate; wake requests are consumed after forcing one non-blocking poll."
CM-004.3,verified,Map signal shutdown,"Process signal handling","src/DownloadEngine.*; src/main.cc; new runtime files","Signal handling enters the same shutdown path as existing DownloadEngine halt behavior.","Focused halt test verifies `requestHalt()` sets halt state and wakes the runtime. Existing global signal flag path remains unchanged.","Force halt also wakes the runtime. Full signal replacement is deferred until the old command loop is retired."
CM-004.4,verified,Plan native event poll removal,"Old event loop ownership","src/EventPoll.*; src/EpollEventPoll.*; src/PollEventPoll.*; src/KqueueEventPoll.*; src/SelectEventPoll.*; src/PortEventPoll.*; src/LibuvEventPoll.*","A deletion plan is recorded for old pollers and libuv after protocol users migrate.","Deletion plan recorded: keep EventPoll implementations only as the CM-004 bridge; delete old pollers and libuv after libcurl, Beast, and ED2K runtime users no longer depend on them.","Physical removal is intentionally deferred because existing protocol commands still depend on EventPoll."
CM-004.5,verified,Verify runtime boundary,"Focused runtime tests","tests/DownloadEngineTest.cc","Runtime start, wake, timer, and shutdown behavior is covered without broad socket-heavy scaffolding.","`build/default/aria2_tests 'All Tests/aria2::DownloadEngineTest'` passed with 4 tests. CSV parser check passed for tracker files.","Focused tests only; no broad socket-heavy scaffolding was added."
