id,status,checkpoint,scope,target_files,acceptance,verification,notes
CM-005.1,pending,Create curl session owner,"libcurl global and multi lifecycle","new CurlSession/CurlTransfer files; src/DownloadEngine.*; cmake/Sources.cmake","A process/runtime-owned libcurl multi handle is initialized, driven, and cleaned up safely.","Pending.","Use multi-socket integration rather than blocking easy perform."
CM-005.2,pending,Create transfer abstraction,"Request to curl easy mapping","new CurlTransfer files; src/RequestGroup.*; src/download_helper.cc","A single ordinary URL transfer can be represented as a curl easy handle with callbacks mapped to aria2-next state.","Pending.","Start with HTTP/HTTPS before FTP/SFTP."
CM-005.3,pending,Map range writes to storage,"Data callback and piece write boundary","new CurlTransfer files; storage files","Received bytes write through existing storage safely, with offset and length truth preserved.","Pending.","Storage redesign is later CM-014; this checkpoint should minimize storage churn."
CM-005.4,pending,Map errors and status,"curl result to aria2-next errors","new CurlTransfer files; src/error_code.h; src/DownloadFailureException.*","curl errors, HTTP status failures, retryable failures, and completion events map to existing result semantics.","Pending.","Do not create a parallel error universe."
CM-005.5,pending,Verify first curl download,"Focused local or public smoke","tests; /Users/sekiro/Desktop/aria2-next-current artifacts","A simple ranged HTTP/HTTPS download can complete through the curl path without native HTTP client ownership.","Pending.","Temporary smoke artifacts stay outside the repository."
