id,status,checkpoint,scope,target_files,acceptance,verification,notes
CM-011.1,verified,Add Boost.JSON adapter,JSON value conversion boundary,new JSON adapter files; src/RpcRequest.*; src/RpcResponse.*,RPC and session JSON can be represented through Boost.JSON without changing supported public response shapes.,BoostJsonValue converts between internal ValueBase values and boost::json::value for parsing and serialization. ValueBase remains a protocol-neutral internal variant for current RPC method boundaries.,Keep conversion narrow until old parser deletion is safe.
CM-011.2,verified,Migrate RPC parsing,JSON-RPC request parser,src/RpcRequest.*; src/rpc_helper.*; tests/RpcMethodTest.cc,JSON-RPC request parsing uses Boost.JSON and preserves supported error behavior.,RpcHttpHandler and RpcWebSocketSession parse JSON-RPC payloads through Boost.JSON conversion and continue mapping invalid JSON to JSON-RPC parse errors. Focused RPC auth and HTTP handler tests passed.,Invalid JSON error mapping must stay deterministic.
CM-011.3,verified,Migrate RPC serialization,JSON-RPC response writer,src/RpcResponse.*; src/RpcMethodImpl.*; tests,JSON-RPC responses serialize through Boost.JSON with stable field names and value types.,RpcResponse and WebSocket notifications serialize ValueBase payloads through Boost.JSON. RpcResponseTest and JsonTest passed with library-owned JSON escaping semantics.,Avoid incidental ordering tests unless public output requires order.
CM-011.4,verified,Remove custom JSON parser,Old JSON source cleanup,src/json.*; src/JsonParser.*; src/JsonDiskWriter.h; tests/JsonTest.cc; tests/ValueBaseJsonParserTest.cc,Custom JSON parser/writer code is deleted or reduced to non-JSON internal variant ownership only.,Deleted JsonParser, JsonDiskWriter, ValueBaseJsonParser, and ValueBaseJsonParserTest. json.cc/json.h now retain only JSONP GET query shaping. Stale active-source scans found no custom parser or writer references.,Delete obsolete parser tests.
CM-011.5,verified,Verify JSON migration,RPC and stale parser scans,tests; source scans,RPC JSON tests pass and stale custom JSON parser scans match final ownership.,"cmake --preset default passed. cmake --build --preset default passed. JsonTest, RpcResponseTest, RpcHttpHandlerTest, WebSocketSessionManTest, and RpcMethod authorize test passed. CSV parser check passed for 22 tracker files. Stale scans found no old custom JSON parser/writer references outside tracker history.",Boost.JSON version comes from Boost baseline.
